{
  "schemaVersion": 2,
  "sceneId": "scene:sha256:1111111111111111111111111111111111111111111111111111111111111111",
  "inputRevision": "input:sha256:2222222222222222222222222222222222222222222222222222222222222222",
  "sceneDigest": "sha256:0000000000000000000000000000000000000000000000000000000000000000",
  "page": {"pageBounds": {"x": 0, "y": 0, "width": 80, "height": 70}, "drawingBounds": {"x": 4, "y": 4, "width": 68, "height": 64}},
  "plotFrame": {"columns": 17, "rows": 16, "columnLabels": "ALPHA", "rowLabels": "NUMERIC"},
  "snapGrid": {"sheetId": "rolling-shutter", "step": 1, "drawingOrigin": {"x": 4, "y": 4}, "formulaVersion": "athena-grid-2"},
  "styles": [{"styleId": "style:sha256:3333333333333333333333333333333333333333333333333333333333333333", "strokeRgba": "#000000ff", "fillRgba": "#ffffffff", "strokeWidth": 1, "dash": [], "lineCap": "BUTT", "lineJoin": "MITER", "fillRule": "NONZERO", "opacity": 255, "fontSize": 1, "fontWeight": 400, "textAlign": "START", "textBaseline": "ALPHABETIC", "routeMarker": "NONE", "portDisplay": "MARKER"}],
  "assets": [],
  "occurrences": [{"elementId": "occurrence:sha256:aaaaaaaaaaaaaaaaaaaaaaaaaaaaaaaaaaaaaaaaaaaaaaaaaaaaaaaaaaaaaaaa", "occurrenceId": "Supply", "subjectId": "supply", "semanticId": "supply", "bounds": {"x": 6, "y": 6, "width": 4, "height": 4}, "placementAnchor": {"x": 8, "y": 8}, "zIndex": 10, "styleId": "style:sha256:3333333333333333333333333333333333333333333333333333333333333333", "traceId": "trace:sha256:4444444444444444444444444444444444444444444444444444444444444444", "ports": [], "labels": []}],
  "connections": [],
  "decorations": [],
  "traces": [{"traceId": "trace:sha256:4444444444444444444444444444444444444444444444444444444444444444", "origins": [{"relativePath": "src/com/engineeringood/m46/rollingshutter/rolling-shutter.athena", "sourceDigest": "5555555555555555555555555555555555555555555555555555555555555555", "role": "SEMANTIC_DECLARATION", "startLine": 0, "startCharacter": 0, "endLine": 0, "endCharacter": 6, "subjectId": "supply", "primary": true}]}]
}
